name,category,calories,protein,fat,carbs
"Babyfood, dessert, peach cobbler, junior",Snack,67,0.3,0,18.3
"Babyfood, dessert, fruit dessert, without ascorbic acid, junior",Snack,63,0.3,0,17.2
"Babyfood, dessert, tropical fruit, junior",Snack,60,0.2,0,16.4
"Babyfood, dessert, custard pudding, vanilla, strained",Snack,85,1.6,2,16
"Babyfood, dessert, custard pudding, vanilla, junior",Snack,86,1.76,0.98,17.6
"Babyfood, juice, apple and grape",Snack,46,0.1,0.2,11.3
"Infant formula, ABBOTT NUTRITION, SIMILAC, ISOMIL, ADVANCE with iron, liquid concentrate",Snack,536,3.13,6.98,13.2
"Infant formula, ABBOTT NUTRITION, SIMILAC, ISOMIL, ADVANCE with iron, ready-to-feed",Snack,66,1.61,3.59,6.7
"Infant formula, ABBOTT NUTRITION, SIMILAC, ISOMIL, ADVANCE with iron, powder, not reconstituted",Snack,2160,12.6,28.1,53.6
"Infant formula, NESTLE, GOOD START SUPREME, with iron, DHA and ARA, ready-to-feed",Snack,66,1.45,3.37,7.39
"Infant formula, NESTLE, GOOD START SUPREME, with iron, DHA and ARA, prepared from liquid concentrate",Snack,66,1.45,3.37,7.39
"Infant Formula, MEAD JOHNSON, ENFAMIL GENTLEASE, with iron, prepared from powder",Snack,68,1.51,3.5,7.6
"Babyfood, fortified cereal bar, fruit filling",Snack,1440,5.43,5.3,68.6
"Infant Formula, MEAD JOHNSON, ENFAMIL, GENTLEASE, with ARA and DHA powder not reconstituted",Snack,516,11.7,27,56.5
"Infant formula, MEAD JOHNSON, ENFAMIL, Enfagrow, Soy, Toddler ready-to-feed",Snack,273,2.17,2.89,7.64
"Infant formula, MEAD JOHNSON, ENFAMIL, NUTRAMIGEN AA, ready-to-feed",Snack,66,1.84,3.48,6.76
"Infant formula, MEAD JOHNSON, ENFAMIL, Premature, with iron, 20 calories, ready-to-feed",Snack,265,2.2,3.3,6.2
"Infant formula, MEAD JOHNSON, ENFAMIL, Premature, with iron, 24 calories, ready-to-feed",Snack,81,2.6,3.9,8.88
"Infant formula, GERBER, GOOD START 2, PROTECT PLUS, ready-to-feed",Snack,273,1.44,3.37,7.39
"Infant formula, ABBOTT NUTRITION, SIMILAC, GO AND GROW, ready-to-feed, with ARA and DHA",Snack,66,1.97,3.54,6.69
"Infant formula, ABBOTT NUTRITION, SIMILAC, Expert Care, Diarrhea, ready- to- feed with ARA and DHA",Snack,274,1.76,3.6,6.67
"Infant formula, ABBOTT NUTRITION, SIMILAC, For Spit Up, ready-to-feed, with ARA and DHA",Snack,66,1.4,3.54,7.19
"Babyfood, Snack, GERBER, GRADUATES, LIL CRUNCHIES, baked whole grain corn snack",Snack,2110,0,28.6,61.6
"Infant formula, ABBOTT NUTRITION, SIMILAC, For Spit Up, powder, with ARA and DHA",Snack,2150,11,27.8,55
"Fat, beef tallow",Lunch,3770,0,100,0
Lard,Snack,3770,0,100,0
"Salad dressing, thousand island, commercial, regular",Snack,379,1.09,35.1,14.6
"Salad dressing, mayonnaise type, regular, with salt",Snack,250,0.65,21.6,14.8
"Salad dressing, french dressing, reduced fat",Snack,222,0.58,11.5,31.2
"Salad dressing, italian dressing, commercial, reduced fat",Snack,102,0.39,6.68,9.99
"Salad dressing, mayonnaise, imitation, soybean",Snack,969,0.3,19.2,16
"Salad dressing, mayonnaise, imitation, milk cream",Snack,404,2.1,5.1,11.1
"Salad dressing, mayonnaise, imitation, soybean without cholesterol",Snack,2020,0.1,47.7,15.8
"Sandwich spread, with chopped pickle, regular, unspecified oils",Snack,389,0.9,34,22.4
"Oil, peanut, salad or cooking",Snack,884,0,100,0
"Oil, soybean, salad or cooking",Snack,884,0,100,0
"Oil, coconut",Snack,892,0,99.1,0
"Oil, olive, salad or cooking",Snack,3700,0,100,0
"Salad dressing, french dressing, commercial, regular",Snack,419,0.87,39.1,18.8
"Margarine,spread, 35-39% fat, tub",Snack,1460,0.23,38,1.52
"Salad dressing, french, home recipe",Snack,2640,0.1,70.2,3.4
"Salad dressing, home recipe, vinegar and oil",Snack,1880,0,50.1,2.5
"Salad dressing, mayonnaise, soybean oil, without salt",Snack,3000,1.1,79.4,2.7
"Salad dressing, french, cottonseed, oil, home recipe",Snack,2640,0.1,70.2,3.4
"Salad dressing, french dressing, fat-free",Snack,551,0.2,0.27,32.1
"Oil, cocoa butter",Snack,3700,0,100,0
"Vegetable oil, palm kernel",Snack,3610,0,100,0
"Oil, poppyseed",Snack,3700,0,100,0
"Oil, tomatoseed",Snack,3700,0,100,0
"Oil, teaseed",Snack,3700,0,100,0
"Oil, soybean lecithin",Snack,3190,0,100,0
"Oil, hazelnut",Snack,3700,0,100,0
"Oil, babassu",Snack,3700,0,100,0
"Oil, sheanut",Snack,3700,0,100,0
"Oil, PAM cooking spray, original",Snack,3310,0.26,78.7,20.7
"Margarine, margarine-like vegetable oil spread, 67-70% fat, tub",Snack,606,0.07,68.3,0.59
"Margarine, 80% fat, tub, CANOLA HARVEST Soft Spread (canola, palm and palm kernel oils)",Snack,3060,0.41,80.3,1.39
"Oil, cooking and salad, ENOVA, 80% diglycerides",Snack,884,0,100,0
"Margarine-like, vegetable oil spread, approximately 37% fat, unspecified oils, with salt, with added vitamin D",Snack,1420,0.51,37.8,0.66
"Margarine, regular, 80% fat, composite, stick, with salt, with added vitamin D",Snack,3000,0.16,80.7,0.7
"Margarine, regular, 80% fat, composite, tub, with salt, with added vitamin D",Snack,713,0.22,80.2,0.75
"Margarine-like, vegetable oil spread, 60% fat, stick, with salt, with added vitamin D",Snack,2250,0.12,60.4,0.69
"Oil, industrial, soy, low linolenic",Snack,3770,0,100,0
"Oil, industrial, soy, ultra low linolenic",Snack,884,0,100,0
"Oil, industrial, soy, fully hydrogenated",Snack,3700,0,100,0
"Oil, industrial, cottonseed, fully hydrogenated",Snack,884,0,100,0
"Oil, flaxseed, contains added sliced flaxseed",Snack,878,0.37,99,0.39
"Mayonnaise, reduced fat, with olive oil",Snack,1510,0.37,40,0
"Salad dressing, mayonnaise-type, light",Snack,158,0.65,10,16.4
"Chicken, broiler, rotisserie, BBQ, breast, meat only",Lunch,144,28,3.57,0
"Chicken, broilers or fryers, meat and skin and giblets and neck, stewed",Lunch,216,24.5,12.4,0.06
"Chicken, broilers or fryers, meat and skin, raw",Lunch,900,18.6,15.1,0
"Chicken, broilers or fryers, meat and skin, cooked, fried, batter",Lunch,289,22.5,17.4,9.42
"Chicken, broilers or fryers, meat and skin, cooked, fried, flour",Lunch,269,28.6,14.9,3.15
"Chicken, broilers or fryers, meat and skin, cooked, roasted",Lunch,239,27.3,13.6,0
"Chicken, broilers or fryers, meat only, cooked, stewed",Lunch,177,27.3,6.71,0
"Chicken, broilers or fryers, skin only, raw",Lunch,1460,13.3,32.4,0
"Chicken, broilers or fryers, skin only, cooked, fried, batter",Lunch,394,10.3,28.8,23.2
"Chicken, broilers or fryers, skin only, cooked, fried, flour",Lunch,502,19.1,42.6,9.34
"Chicken, broilers or fryers, giblets, cooked, simmered",Lunch,157,27.2,4.5,0
"Chicken, gizzard, all classes, raw",Lunch,94,17.7,2.06,0
"Chicken, gizzard, all classes, cooked, simmered",Lunch,154,30.4,2.68,0
"Chicken, heart, all classes, raw",Lunch,153,15.6,9.33,0.71
"Chicken, broilers or fryers, light meat, meat and skin, cooked, fried, batter",Lunch,277,23.6,15.4,9.5
"Chicken, broilers or fryers, light meat, meat and skin, cooked, fried, flour",Lunch,246,30.4,12.1,1.82
"Chicken, broilers or fryers, light meat, meat and skin, cooked, roasted",Lunch,222,29,10.8,0
"Chicken, broilers or fryers, light meat, meat and skin, cooked, stewed",Lunch,201,26.1,9.97,0
"Chicken, broilers or fryers, dark meat, meat and skin, raw",Lunch,237,16.7,18.3,0
"Chicken, broilers or fryers, light meat, meat only, raw",Lunch,114,23.2,1.65,0
"Chicken, broilers or fryers, light meat, meat only, cooked, fried",Lunch,192,32.8,5.54,0.42
"Chicken, broilers or fryers, light meat, meat only, cooked, roasted",Lunch,173,30.9,4.51,0
"Chicken, broilers or fryers, light meat, meat only, cooked, stewed",Lunch,159,28.9,3.99,0
"Chicken, broilers or fryers, separable fat, raw",Lunch,629,3.73,68,0
"Chicken, broilers or fryers, back, meat and skin, raw",Lunch,319,14,28.7,0
"Chicken, broilers or fryers, back, meat and skin, cooked, fried, batter",Lunch,331,22,21.9,10.2
"Chicken, broilers or fryers, back, meat and skin, cooked, fried, flour",Lunch,331,27.8,20.7,6.5
"Chicken, broilers or fryers, back, meat only, cooked, roasted",Lunch,239,28.2,13.2,0
"Chicken, broilers or fryers, back, meat only, cooked, stewed",Lunch,209,25.3,11.2,0
"Chicken, broilers or fryers, breast, meat and skin, raw",Lunch,720,20.8,9.25,0
"Chicken, broilers or fryers, breast, meat and skin, cooked, fried, batter",Lunch,260,24.8,13.2,8.99
"Chicken, broilers or fryers, breast, meat and skin, cooked, fried, flour",Lunch,222,31.8,8.87,1.64
"Chicken, broilers or fryers, breast, meat only, cooked, roasted",Lunch,165,31,3.57,0
"Chicken, broilers or fryers, breast, meat only, cooked, stewed",Lunch,151,29,3.03,0
"Turkey, whole, meat and skin, cooked, roasted",Snack,790,28.6,7.39,0.06
"Turkey, whole, meat only, raw",Snack,115,22.6,1.93,0.14
"Turkey, whole, meat only, cooked, roasted",Snack,664,29.1,3.84,0
"Turkey, whole, skin (light and dark), raw",Snack,407,13,38.9,0.16
"Turkey, all classes, gizzard, cooked, simmered",Snack,648,26.4,4.64,0
"Turkey, all classes, heart, raw",Snack,140,16.7,7.44,0.4
"Turkey, all classes, heart, cooked, simmered",Snack,728,24.9,7.52,0
"Turkey, all classes, liver, raw",Snack,128,18.3,5.5,0
"Turkey, all classes, liver, cooked, simmered",Snack,791,27,8.18,0
"Turkey, dark meat, meat and skin, raw",Snack,695,19.8,8.97,0.15
"Turkey, whole, dark meat, meat and skin, cooked, roasted",Snack,864,27.3,9.95,0.07
"Turkey, whole, light meat, raw",Snack,114,23.7,1.48,0.14
"Turkey, all classes, light meat, cooked, roasted",Snack,617,30.1,2.08,0
"Turkey, all classes, breast, meat and skin, cooked, roasted",Snack,189,28.7,7.41,0
"Turkey, all classes, leg, meat and skin, raw",Snack,144,19.5,6.72,0
"Turkey, all classes, leg, meat and skin, cooked, roasted",Snack,208,27.9,9.82,0
"Turkey, all classes, wing, meat and skin, raw",Snack,197,20.2,12.3,0
"Turkey, whole, breast, meat only, cooked, roasted",Snack,147,30.1,2.08,0
"Turkey, whole, wing, meat only, raw",Snack,115,23.7,1.48,0.14
"Turkey, whole, wing, meat only, cooked, roasted",Snack,147,30.1,2.08,0
"Turkey, young hen, skin only, cooked, roasted",Snack,482,19,44.4,0
"Turkey and gravy, frozen",Snack,67,5.88,2.63,4.61
"Turkey breast, pre-basted, meat and skin, cooked, roasted",Snack,126,22.2,3.46,0
"Turkey thigh, pre-basted, meat and skin, cooked, roasted",Snack,157,18.8,8.54,0
"Turkey roast, boneless, frozen, seasoned, light and dark meat, raw",Snack,120,17.6,2.2,6.4
"Turkey, mechanically deboned, from turkey frames, raw",Snack,201,13.3,16,0
"Turkey, Ground, raw",Snack,148,19.7,7.66,0
"Turkey, Ground, cooked",Snack,203,27.4,10.4,0
"Chicken, cornish game hens, meat and skin, raw",Lunch,200,17.2,14,0
"Chicken, wing, frozen, glazed, barbecue flavored, heated (microwave)",Lunch,248,25.3,13.9,3.84
"Chicken, broilers or fryers, breast, skinless, boneless, meat only, with added solution, raw",Lunch,453,20.3,3,0
"Duck, young duckling, domesticated, White Pekin, breast, meat and skin, boneless, cooked, roasted",Snack,202,24.5,10.8,0
"Duck, young duckling, domesticated, White Pekin, breast, meat only, boneless, cooked without skin, broiled",Snack,140,27.6,2.5,0
"Chicken patty, frozen, uncooked",Lunch,292,14.3,20,13.6
"Chicken patty, frozen, cooked",Lunch,1200,14.8,19.6,12.8
"Chicken breast tenders, breaded, cooked, microwaved",Lunch,252,16.4,12.9,17.6
"Chicken breast tenders, breaded, uncooked",Lunch,1100,14.7,15.8,15
"Chicken, broiler, rotisserie, BBQ, wing, meat only",Lunch,768,28.3,7.79,0.54
"Chicken, broilers or fryers, rotisserie, original seasoning, back, meat only, cooked",Lunch,859,25.3,11.5,0
"Chicken, broilers or fryers, rotisserie, original seasoning, breast, meat only, cooked",Lunch,574,28,2.79,0
"Chicken, broilers or fryers, drumstick, rotisserie, original seasoning, meat only, cooked",Lunch,738,28.7,6.81,0
"Chicken, broilers or fryers, rotisserie, original seasoning, skin only, cooked",Lunch,1700,17.7,37.2,0.11
"Chicken, broilers or fryers,  rotisserie, original seasoning, drumstick, meat and skin, cooked",Lunch,901,26.9,12,0.02
"Chicken, broilers or fryers, rotisserie, original seasoning, thigh, meat and skin, cooked",Lunch,233,22.9,15.7,0.02
"Chicken, broilers or fryers, rotisserie, original seasoning, wing, meat and skin, cooked",Lunch,1120,24.3,18.8,0.04
"Chicken, broiler, rotisserie, BBQ, skin",Lunch,378,15.2,35.2,0.7
"Turkey, drumstick, from whole bird, meat only, with added solution, raw",Snack,480,19.3,4.12,0.15
"Turkey, wing, from whole bird, meat only, with added solution, raw",Snack,102,21.5,1.66,0.14
"Turkey, wing, from whole bird, meat only, with added solution, roasted",Snack,530,27,2.08,0
"Turkey, retail parts, breast, meat and skin, raw",Snack,155,21.9,7.45,0
"Turkey, retail parts, breast, meat and skin, cooked, roasted",Snack,687,29,5.33,0.05
"Turkey, drumstick, from whole bird, meat only, roasted",Snack,583,30.1,2.08,0
"Turkey, thigh, from whole bird, meat only, raw",Snack,108,21.3,2.5,0.15
"Turkey, thigh, from whole bird, meat only, roasted",Snack,691,27.7,6.04,0
"Turkey, retail parts, thigh, meat and skin, raw",Snack,161,19.5,9.16,0
"Chicken, broiler or fryers, breast, skinless, boneless, meat only, cooked, grilled",Lunch,151,30.5,3.17,0
"Chicken, broiler or fryers, breast, skinless, boneless, meat only, with added solution, cooked, braised",Lunch,609,28.2,3.61,0
"Chicken, broiler or fryers, breast, skinless, boneless, meat only, with added solution, cooked, grilled",Lunch,148,29.5,3.39,0
"Soup, cream of asparagus, canned, condensed",Snack,289,1.82,3.26,8.52
"Soup, beef broth or bouillon canned, ready-to-serve",Lunch,29,1.14,0.22,0.04
"Soup, beef noodle, canned, condensed",Lunch,280,3.85,2.46,7.16
"Soup, cream of celery, canned, condensed",Snack,301,1.32,4.46,7.03
"Soup, cheese, canned, condensed",Snack,82,0.8,3.92,11.3
"Soup, chicken broth, canned, condensed",Lunch,130,4.42,1.04,0.75
"Soup, chicken noodle, canned, condensed",Lunch,48,2.37,1.55,6.07
"Soup, chicken rice, canned, chunky, ready-to-serve",Lunch,222,5.11,1.33,5.41
"Soup, chicken with rice, canned, condensed",Lunch,285,1.84,1.56,11.6
"Soup, chicken and vegetable, canned, ready-to-serve",Lunch,137,1.97,0.73,4.68
"Soup, clam chowder, new england, canned, condensed",Snack,72,3.17,2.06,10.3
"Soup, beef broth bouillon and consomme, canned, condensed",Lunch,11,2.52,0,0.32
"Soup, lentil with ham, canned, ready-to-serve",Snack,56,3.74,1.12,8.16
"Soup, minestrone, canned, chunky, ready-to-serve",Snack,222,2.13,1.17,8.64
"Soup, onion, canned, condensed",Snack,192,3.06,1.42,6.68
"Soup, cream of onion, canned, condensed",Snack,368,2.2,4.2,10.4
"Soup, oyster stew, canned, condensed",Snack,201,1.72,3.13,3.32
"Soup, pea, green, canned, condensed",Snack,523,6.54,2.23,20.2
"Soup, pea, split with ham, canned, chunky, ready-to-serve",Snack,322,4.62,1.66,11.2
"CAMPBELL'S, Chicken Noodle Soup, condensed",Lunch,197,2.37,1.53,5.97
"Soup, tomato rice, canned, condensed",Snack,389,1.64,2.12,17.1
"Soup, turkey, chunky, canned, ready-to-serve",Snack,238,4.33,1.87,5.96
"Soup, chunky vegetable, canned, ready-to-serve",Snack,165,1.14,0.36,7.9
"Soup, beef broth or bouillon, powder, dry",Lunch,213,16,8.89,17.4
"Soup, beef broth, cubed, dry",Lunch,711,17.3,4,16.1
"Soup, chicken broth or bouillon, dry",Lunch,1120,16.7,13.9,18
"Soup, chicken broth cubes, dry",Lunch,828,14.6,4.7,23.5
"Gravy, beef, canned, ready-to-serve",Lunch,222,3.75,2.36,4.81
"Gravy, brown, dry",Snack,367,10.7,9.61,59.4
"Gravy, chicken, canned or bottled, ready-to-serve",Lunch,48,0.71,2.62,5.29
"Gravy, chicken, dry",Lunch,381,11.3,9.73,62.1
"Gravy, turkey, canned, ready-to-serve",Snack,213,2.6,2.1,5.1
"Gravy, turkey, dry",Snack,367,10.4,7.19,65.1
"Gravy, unspecified type, dry",Snack,344,13,8,58
"Soup, chicken noodle, dry, mix",Lunch,377,15.4,6.51,62.3
"Soup, beef mushroom, canned, prepared with equal volume water",Lunch,126,2.37,1.23,2.6
"Soup, chicken mushroom, canned, prepared with equal volume water",Lunch,226,1.8,3.75,3.8
"Soup, tomato bisque, canned, prepared with equal volume water",Snack,209,0.92,1.02,9.6
"Sauce, peanut, made from coconut, water, sugar, peanuts",Snack,179,2.02,6.34,28.5
"SMART SOUP, Santa Fe Corn Chowder",Snack,55,2,0.71,11.2
"SMART SOUP, French Lentil",Snack,222,2.9,1.06,9.5
"SMART SOUP, Greek Minestrone",Snack,40,1.7,0.53,8.4
"Sauce, pesto, ready-to-serve, refrigerated",Snack,1750,9.83,37.6,10.1
"Sauce, pesto, ready-to-serve, shelf stable",Snack,426,5,42.4,6.14
"Sauce, pesto, BUITONI, pesto with basil, ready-to-serve, refrigerated",Snack,1750,9.83,37.6,10.1
"Sauce, pesto, CLASSICO, basil pesto, ready-to-serve",Snack,372,4.16,36.4,6.93
"Soup, vegetable broth, ready to serve",Snack,5,0.24,0.07,0.93
"Sauce, cheese sauce mix, dry",Snack,438,7.68,18.3,60.5
"Soup, chicken corn chowder, chunky, ready-to-serve, single brand",Lunch,99,3.1,6.3,7.5
"Soup, bean with bacon, condensed, single brand",Snack,117,6.5,2.1,18
"Soup, tomato, canned, condensed, reduced sodium",Snack,273,1.61,0.56,13.4
"Gravy, brown instant, dry",Snack,1590,8.53,11.8,59.8
"Gravy, instant beef, dry",Lunch,1540,9.8,9.48,61.1
"Gravy, instant turkey, dry",Snack,1710,11.7,14.7,57.6
"Soup, tomato, low sodium, with water",Snack,124,0.79,0.28,6.57
"Soup, pea, low sodium, prepared with equal volume water",Snack,62,3.2,1.09,9.88
"Soup, chicken noodle, low sodium, canned, prepared with equal volume water",Lunch,106,1.27,0.95,2.95
"Soup, vegetable soup, condensed, low sodium, prepared with equal volume water",Snack,33,1.1,0.45,6.06
"Sauce, tomato chili sauce, bottled, with salt",Snack,92,2.5,0.3,19.8
"Soup, vegetable chicken, canned, prepared with water, low sodium",Lunch,69,5.1,2,8.76
"Sauce, pasta, spaghetti/marinara, ready-to-serve, low sodium",Snack,51,1.41,1.48,8.06
"Gravy, meat or poultry, low sodium, prepared",Snack,222,3.8,2.4,6.16
"Gravy, HEINZ Home Style, savory beef",Lunch,39,1.09,1.13,6.24
"Gravy, CAMPBELL'S, chicken",Lunch,215,0.79,2.73,5.87
"Barbecue loaf, pork, beef",Lunch,173,15.8,8.9,6.4
"Soup, cream of chicken, canned, condensed, reduced sodium",Lunch,58,1.8,1.3,9.5
"Sauce, alfredo mix, dry",Snack,2240,15.3,36.4,36.5
"Sauce, peppers, hot, chili, mature red, canned",Snack,21,0.9,0.6,3.9
"Sauce, chili, peppers, hot, immature green, canned",Snack,84,0.7,0.1,5
Fish broth,Snack,67,2,0.6,0.4
"Soup, cream of mushroom, low sodium, ready-to-serve, canned",Snack,222,1,3.7,4.53
"Potato soup, instant, dry mix",Snack,343,9.2,3.1,76.1
"Soup, chicken broth, low sodium, canned",Lunch,67,2,0.6,1.2
"Sauce, worcestershire",Snack,77,0,0,19.2
"Soup, beef and mushroom, low sodium, chunk style",Lunch,69,4.3,2.3,9.58
"Soup, beef stroganoff, canned, chunky style, ready-to-serve",Lunch,410,5.1,4.6,9
"Soup, bouillon cubes and granules, low sodium, dry",Snack,438,16.7,13.9,64.9
"Soup, ramen noodle, beef flavor, dry",Lunch,1850,10.1,17.7,60.3
"Soup, ramen noodle, chicken flavor, dry",Lunch,439,10.2,17.5,60.2
"Beerwurst, beer salami, pork",Snack,238,14.2,18.8,2.06
"Sausage, Berliner, pork, beef",Lunch,230,15.3,17.2,2.59
Blood sausage,Snack,1580,14.6,34.5,1.29
"Bockwurst, pork, veal, raw",Snack,1260,14,25.9,2.95
"Bratwurst, pork, cooked",Snack,1390,13.7,29.2,2.85
"Braunschweiger (a liver sausage), pork",Snack,1370,14.5,28.5,3.1
"Bratwurst, pork, beef, link",Lunch,323,14.3,27.8,2.98
"Cheesefurter, cheese smokie, pork, beef",Lunch,328,14.1,29,1.51
"Frankfurter, chicken",Lunch,223,15.5,16.2,2.74
"Frankfurter, turkey",Snack,933,12.2,17.3,3.81
"Ham, chopped, canned",Snack,1000,16.1,18.8,0.26
"Ham, chopped, not canned",Snack,925,16.5,16.7,0
Ham and cheese loaf or roll,Snack,241,13.6,18.7,4
Ham and cheese spread,Snack,245,16.2,18.5,2.28
"Headcheese, pork",Snack,658,13.8,10.9,0
"Sausage, Italian, pork, mild, raw",Snack,290,13.9,24.3,2.97
"Sausage, pork and turkey, pre-cooked",Snack,1430,12,30.6,3.63
"Frankfurter, meat and poultry, cooked, boiled",Snack,1240,10.3,26.3,4.96
"Frankfurter, meat and poultry, cooked, grilled",Snack,302,10.7,26.4,5.24
"Pork sausage, link/patty, reduced fat, unprepared",Snack,217,16.8,16.6,0.2
"Pork sausage, link/patty, reduced fat, cooked, pan-fried",Snack,1120,20.9,20.3,0.15
"Bologna, meat and poultry",Snack,281,10.3,23.8,6.31
"Meatballs, frozen, Italian style",Snack,1200,14.4,22.2,8.06
"Bacon, turkey, microwaved",Snack,1540,29.5,25.9,4.24
"Bacon, turkey, low sodium",Snack,1060,13.3,20,4.8
"Cereals ready-to-eat, POST, ALPHA-BITS",Snack,1630,10,4.6,80.3
"Cereals ready-to-eat, QUAKER, CAP'N CRUNCH",Snack,1660,4.39,5.12,85.5
"Cereals ready-to-eat, QUAKER, CAP'N CRUNCH with CRUNCHBERRIES",Snack,1660,4.45,4.83,85.9
"Cereals ready-to-eat, QUAKER, CAP'N CRUNCH'S PEANUT BUTTER CRUNCH",Snack,1740,7.1,9.23,78.6
"Cereals ready-to-eat, POST, FRUITY PEBBLES",Snack,402,4.62,4.02,86.1
"Cereals ready-to-eat, granola, homemade",Snack,489,13.7,24.3,53.9
"Cereals ready-to-eat, POST, GRAPE-NUTS Cereal",Snack,1510,11.2,1.81,80.5
"Cereals ready-to-eat, POST, GRAPE-NUTS Flakes",Snack,1570,9.4,3.7,82
"Cereals ready-to-eat, QUAKER, SWEET CRUNCH/QUISP",Snack,1700,4.51,6.08,85
"Cereals ready-to-eat, POST Raisin Bran Cereal",Snack,1350,7.6,1.6,78.9
"Cereals ready-to-eat, QUAKER, QUAKER Puffed Rice",Snack,383,7.01,0.9,87.8
"Cereals ready-to-eat, POST, GOLDEN CRISP",Snack,380,5.5,1.7,90.1
"Cereals ready-to-eat, SUN COUNTRY, KRETSCHMER Honey Crunch Wheat Germ",Snack,1560,26.6,7.78,58.1
"Cereals, corn grits, white, regular and quick, enriched, dry",Snack,370,7.65,1.75,79.1
"Cereals, corn grits, white, regular and quick, enriched, cooked with water, without salt",Snack,298,1.71,0.46,14.8
"Cereals, QUAKER, corn grits, instant, plain, dry",Snack,343,7.31,2.14,78.4
"Cereals, CREAM OF WHEAT, regular (10 minute), cooked with water, without salt",Snack,50,1.44,0.21,10.5
"Cereals, farina, enriched, assorted brands including CREAM OF WHEAT, quick (1-3 minutes), dry",Snack,1510,11.6,1.41,73.2
"Cereals, farina, enriched, assorted brands including CREAM OF WHEAT, quick (1-3 minutes), cooked with water, without salt",Snack,55,1.82,0.34,10.9
"Cereals, CREAM OF WHEAT, instant, dry",Snack,366,10.6,1.4,75.5
"Cereals, oats, instant, fortified, plain, dry",Snack,1520,11.9,6.9,69.5
"Cereals, oats, instant, fortified, plain, prepared with water (boiling water added or microwaved)",Snack,283,2.37,1.36,11.7
"Cereals, QUAKER, Instant Oatmeal, apples and cinnamon, dry",Breakfast,1530,8.62,4.61,76.7
"Cereals, oats, instant, fortified, with cinnamon and spice, dry",Snack,1540,9.53,4.84,76.1
"Cereals, WHEATENA, dry",Snack,357,13.1,2.9,75.6
"Cereals, WHEATENA, cooked with water",Snack,56,2,0.5,11.8
"Cereals, whole wheat hot natural cereal, dry",Snack,1430,11.2,2,75.2
"Cereals, whole wheat hot natural cereal, cooked with water, without salt",Snack,259,2,0.4,13.7
"Cereals ready-to-eat, QUAKER, QUAKER Puffed Wheat",Snack,366,16.3,2.15,76.4
"Cereals, corn grits, yellow, regular and quick, unenriched, dry",Snack,371,8.8,1.2,79.6
"Cereals, corn grits, white, regular and quick, enriched, cooked with water, with salt",Snack,71,1.71,0.46,14.8
"Cereals, corn grits, yellow, regular and quick, enriched, cooked with water, without salt",Snack,65,1.23,0.39,13.9
"Cereals, corn grits, yellow, regular, quick, enriched, cooked with water, with salt",Snack,65,1.23,0.39,13.9
"Cereals, MALT-O-MEAL, chocolate, dry",Snack,1520,10.6,0.82,79.6
"Cereals, oats, regular and quick and instant, unenriched, cooked with water (includes boiling and microwaving), with salt",Snack,71,2.54,1.52,12
"Cereals, WHEATENA, cooked with water, with salt",Snack,247,2.03,0.45,11.7
"Cereals, whole wheat hot natural cereal, cooked with water, with salt",Snack,259,2,0.4,13.7
"Cereals, ready-to-eat, MALT-O-MEAL, Blueberry Mini SPOONERS",Snack,1460,8.81,1.92,79.4
"Cereals ready-to-eat, MALT-O-MEAL, OAT BLENDERS with honey",Snack,396,6.78,4.17,84.9
"Cereals ready-to-eat, MALT-O-MEAL, OAT BLENDERS with honey & almonds",Snack,1590,7.8,4.88,77.3
"Cereals ready-to-eat, MALT-O-MEAL, Honey Nut SCOOTERS",Snack,1620,8.59,4.51,79.6
"Cereals, QUAKER, Instant Oatmeal, Cinnamon Swirl, high fiber",Breakfast,1530,8.79,4.8,75.7
"Cereals, QUAKER, oatmeal, REAL MEDLEYS, blueberry hazelnut, dry",Breakfast,386,9.81,9.8,69.5
"Cereals, QUAKER, oatmeal, REAL MEDLEYS, apple walnut, dry",Breakfast,1630,8.18,10.4,70.5
"Cereals, QUAKER, oatmeal, REAL MEDLEYS, summer berry, dry",Breakfast,353,11.3,4.4,72.6
"Acerola, (west indian cherry), raw",Snack,32,0.4,0.3,7.69
"Acerola juice, raw",Snack,23,0.4,0.3,4.8
"Apples, raw, with skin (Includes foods for USDA's Food Distribution Program)",Snack,218,0.26,0.17,13.8
"Apples, raw, without skin",Snack,48,0.27,0.13,12.8
"Apples, dehydrated (low moisture), sulfured, stewed",Snack,74,0.28,0.12,19.9
"Apples, dried, sulfured, uncooked",Snack,243,0.93,0.32,65.9
"Apples, dried, sulfured, stewed, without added sugar",Snack,57,0.22,0.07,15.3
"Apples, dried, sulfured, stewed, with added sugar",Snack,83,0.2,0.07,20.7
"Apples, frozen, unsweetened, unheated (Includes foods for USDA's Food Distribution Program)",Snack,48,0.28,0.32,12.3
"Applesauce, canned, unsweetened, without added ascorbic acid (Includes foods for USDA's Food Distribution Program)",Snack,42,0.17,0.1,11.3
"Applesauce, canned, sweetened, without salt",Snack,283,0.16,0.17,17.5
"Apricots, raw",Snack,201,1.4,0.39,11.1
"Apricots, canned, water pack, with skin, solids and liquids",Snack,27,0.71,0.16,6.39
"Apricots, canned, heavy syrup pack, with skin, solids and liquids",Snack,83,0.53,0.08,21.5
"Apricots, canned, heavy syrup pack, without skin, solids and liquids",Snack,83,0.51,0.09,21.4
"Apricots, canned, extra heavy syrup pack, without skin, solids and liquids",Snack,96,0.55,0.04,24.8
"Apricots, dehydrated (low-moisture), sulfured, uncooked",Snack,320,4.9,0.62,82.9
"Apricots, frozen, sweetened",Snack,98,0.7,0.1,25.1
"Apricot nectar, canned, with added ascorbic acid",Snack,56,0.17,0.45,13.6
"Avocados, raw, all commercial varieties",Snack,160,2,14.7,8.53
"Avocados, raw, California",Snack,697,1.96,15.4,8.64
"Avocados, raw, Florida",Snack,120,2.23,10.1,7.82
"Cherries, tart, dried, sweetened (Includes foods for USDA's Food Distribution Program)",Snack,1400,1.25,0.73,80.4
