name,category,calories,protein,fat,carbs
"Beverages, Malted drink mix, natural, powder, dairy based.",Snack,1790,14.3,9.52,71.2
"Beverages, Malted drink mix, natural, powder, prepared with whole milk",Snack,88,3.86,3.62,10.2
"Beverages, OVALTINE, chocolate malt powder",Snack,1560,0,0,93
"Beverages, orange and apricot juice drink, canned",Snack,213,0.3,0.1,12.7
"Beverages, pineapple and grapefruit juice drink, canned",Snack,197,0.2,0.1,11.6
"Beverages, pineapple and orange juice drink, canned",Snack,209,1.3,0,11.8
"Shake, fast food, vanilla",Snack,620,3.37,6.52,19.6
"Beverages, tea, black, brewed, prepared with tap water",Snack,1,0,0,0.3
"Beverages, tea, instant, decaffeinated, lemon, diet",Snack,338,3.3,0.6,85.4
"Beverages, tea, instant, decaffeinated, lemon, sweetened",Snack,401,0.12,0.73,98.6
"Beverages, tea, instant, unsweetened, powder",Snack,1320,20.2,0,58.7
"Beverages, tea, instant, lemon, diet",Snack,2,0.02,0,0.44
"Beverages, tea, herb, other than chamomile, brewed",Snack,4,0,0,0.2
"Beverages, water, bottled, PERRIER",Snack,0,0,0,0
"Beverages, water, bottled, POLAND SPRING",Snack,0,0,0,0
"Beverages, orange-flavor drink, breakfast type, powder",Snack,1620,0,0,98.9
"Beverages, orange-flavor drink, breakfast type, powder, prepared with water",Snack,49,0,0,12.6
"Beverages, Orange-flavor drink, breakfast type, low calorie, powder",Snack,217,3.6,0,85.9
"English muffins, plain, unenriched, without calcium propionate (includes sourdough)",Snack,235,7.7,1.8,46
"Pie, apple, commercially prepared, unenriched flour",Snack,237,1.9,11,34
"Pie, fried pies, cherry",Snack,316,3,16.1,42.6
"Tortillas, ready-to-bake or -fry, corn, without added salt",Snack,222,5.7,2.5,46.6
"Tortillas, ready-to-bake or -fry, flour, without added calcium",Snack,325,8.7,7.1,55.6
"Cake, pound, commercially prepared, fat-free",Snack,283,5.4,1.2,61
"Cake, yellow, light, dry mix",Snack,404,4.7,5.5,84.1
"Archway Home Style Cookies, Coconut Macaroon",Snack,460,3.02,22.6,61.2
"Archway Home Style Cookies, Date Filled Oatmeal",Breakfast,1670,4.67,12,68.2
"Archway Home Style Cookies, Dutch Cocoa",Snack,431,4.5,15,69.4
"Archway Home Style Cookies, Frosty Lemon",Snack,430,4.41,17.1,64.8
"Archway Home Style Cookies, Iced Molasses",Snack,1760,3.5,14.4,69.1
"Archway Home Style Cookies, Old Fashioned Molasses",Snack,406,4.27,11.8,70.6
"Archway Home Style Cookies, Old Fashioned Windmill Cookies",Snack,1960,5.17,17.6,72.2
"Archway Home Style Cookies, Peanut Butter",Snack,480,9,24.3,58.5
"Archway Home Style Cookies, Raspberry Filled",Snack,400,4.35,13.3,65.9
"George Weston Bakeries, Brownberry Sage and Onion Stuffing Mix, dry",Snack,1630,13.3,5.1,72.7
"Keebler, Keebler Chocolate Graham SELECTS",Snack,465,7.1,16.6,71.8
"Continental Mills, Krusteaz Almond Poppyseed Muffin Mix, Artificially Flavored, dry",Snack,1750,5.6,10.3,75.6
"Mckee Baking, Little Debbie Nutty Bars, Wafers with Peanut Butter, Chocolate Covered",Snack,548,8,32.8,55.2
"Nabisco, Nabisco Ritz Crackers",Snack,2060,7.23,23.2,63.5
"Pillsbury, Buttermilk Biscuits, Artificial Flavor, refrigerated dough",Snack,236,6.4,2.79,47.1
"Pillsbury, Chocolate Chip Cookies, refrigerated dough",Snack,1880,3.82,21.3,60.8
"Pillsbury, Crusty French Loaf, refrigerated dough",Snack,243,8.59,2.88,46.4
"Sorghum flour, refined, unenriched",Snack,357,9.53,1.24,76.8
"Rice, brown, parboiled, cooked, UNCLE BENS",Snack,147,3.09,0.85,31.3
"Pasta, gluten-free, rice flour and rice bran extract, cooked, DE BOLES",Snack,836,4.21,1.7,40.8
"Pasta, gluten-free, corn and rice flour, cooked",Snack,179,3.2,1,38
"Fast foods, biscuit, with egg and bacon",Snack,1280,11.3,20.7,19.1
"Fast foods, biscuit, with egg and ham",Snack,233,10.6,14.1,16.4
"Fast foods, biscuit, with crispy chicken fillet",Lunch,300,11.9,14.9,30.6
"Fast foods, croissant, with egg, cheese, and bacon",Snack,289,12.9,16.4,22.5
"Fast foods, croissant, with egg, cheese, and ham",Snack,1090,12.4,15,19
"Fast foods, croissant, with egg, cheese, and sausage",Snack,308,12.1,21.8,15.9
"Fast foods, egg, scrambled",Snack,887,13.8,16.2,2.08
"Fast foods, potatoes, hash browns, round pieces or patty",Snack,272,2.58,17,28.9
"Fast foods, vanilla, light, soft-serve ice cream, with cone",Snack,163,4.24,4.86,26.4
"Fast foods, sundae, caramel",Snack,196,4.71,5.98,31.8
"Fast foods, sundae, hot fudge",Snack,180,3.57,5.46,30.2
"Fast foods, burrito, with beans and beef",Lunch,191,11.5,7.47,19.5
"Fast foods, burrito, with beans, cheese, and beef",Lunch,753,7.03,6.8,23.4
"PIZZA HUT 12"" Pepperoni Pizza, Hand-Tossed Crust",Snack,1170,12.9,11.4,31.6
"PIZZA HUT 12"" Pepperoni Pizza, Pan Crust",Snack,1250,12,14.2,30.5
"PIZZA HUT 12"" Super Supreme Pizza, Hand-Tossed Crust",Snack,1020,10.9,10.7,25.6
"DOMINO'S 14"" Cheese Pizza, Classic Hand-Tossed Crust",Snack,257,10.8,8.97,33.2
"DOMINO'S 14"" Cheese Pizza, Ultimate Deep Dish Crust",Snack,265,10.8,9.83,33.5
"PAPA JOHN'S 14"" Cheese Pizza, Original Crust",Snack,260,11.5,9.25,32.7
"PAPA JOHN'S 14"" Pepperoni Pizza, Original Crust",Snack,1150,12,11.9,30
"PAPA JOHN'S 14"" The Works Pizza, Original Crust",Snack,240,10.3,10.2,26.7
"PAPA JOHN'S 14"" Cheese Pizza, Thin Crust",Snack,1240,12.3,15.7,26.3
"LITTLE CAESARS 14"" Pepperoni Pizza, Large Deep Dish Crust",Snack,265,12.9,10.8,29
"LITTLE CAESARS 14"" Cheese Pizza, Thin Crust",Snack,1290,16.2,17,22.8
"PIZZA HUT 14"" Cheese Pizza, Hand-Tossed Crust",Snack,275,12,10.4,33.4
"PIZZA HUT 14"" Cheese Pizza, Pan Crust",Snack,1160,10.8,11.2,32.8
"Fast Food, Pizza Chain, 14"" pizza, cheese topping, regular crust",Snack,1110,11.4,9.69,33.3
"Fast Food, Pizza Chain, 14"" pizza, cheese topping, thick crust",Snack,271,10.8,10.5,33.2
"Fast Food, Pizza Chain, 14"" pizza, cheese topping, thin crust",Snack,1260,12.8,14,31.2
"Fast Food, Pizza Chain, 14"" pizza, pepperoni topping, regular crust",Snack,282,11.7,11.9,32
"Fast Food, Pizza Chain, 14"" pizza, pepperoni topping, thick crust",Snack,1200,11.5,12.6,31.8
"McDONALD'S, Chicken McNUGGETS",Lunch,302,15.8,19.8,15.1
"McDONALD'S, Hash Brown",Snack,1130,2.48,16.3,28.6
"McDONALD'S, Hotcakes (plain)",Snack,228,6,5.84,38.3
"McDONALD'S, Bacon, Egg & Cheese McGRIDDLES",Snack,272,12,13.2,26.2
"McDONALD'S, Hot Caramel Sundae",Snack,188,3.58,4.89,33.4
"McDONALD'S, Hot Fudge Sundae",Snack,778,4.14,5.91,30
"McDONALD'S, McFLURRY with M&M'S CANDIES",Snack,177,4.02,6.46,26.8
"McDONALD'S, McFLURRY with OREO cookies",Snack,690,3.97,5.66,25.6
"McDONALD'S, McCHICKEN Sandwich",Lunch,1140,10.4,13.2,28
"McDONALD'S, McCHICKEN Sandwich (without mayonnaise)",Lunch,1000,11.1,8.46,31
"McDONALD'S, Egg McMUFFIN",Snack,228,13.6,9.66,21.7
"McDONALD'S, Sausage McMUFFIN",Snack,1400,12.7,21.1,24.5
"McDONALD'S, Deluxe Breakfast, with syrup and margarine",Snack,285,7.56,15.2,29.5
"McDONALD'S, Hotcakes and Sausage",Snack,294,7.81,12.5,37.6
"McDONALD'S, Hotcakes (with 2 pats margarine & syrup)",Snack,272,4.05,8.06,46.1
"McDONALD'S, Bacon Ranch Salad with Grilled Chicken",Lunch,81,10.3,3.14,3.64
"McDONALD'S, Fruit 'n Yogurt Parfait (without granola)",Snack,90,2.47,1.13,17.7
"McDONALD'S, FILET-O-FISH (without tartar sauce)",Snack,1020,12.5,7.62,31.1
"BURGER KING, CROISSAN'WICH with Sausage, Egg and Cheese",Snack,1290,12.1,21.8,15.9
"BURGER KING, CROISSAN'WICH with Sausage and Cheese",Snack,1570,13.7,25.4,23
"Fast foods, hamburger; single, large patty; with condiments, vegetables and mayonnaise",Snack,226,11.3,12.4,17.3
"Fast foods, hamburger; single, regular patty; double decker bun with condiments and special sauce",Snack,259,12.2,13.3,22.7
"Fast foods, cheeseburger; double, regular patty; with condiments",Snack,1180,16.2,16.2,18
"Fast foods, cheeseburger; double, large patty; with condiments",Snack,272,17,16.2,14.4
"Fast foods, chicken tenders",Lunch,271,19.2,14,17.2
"Fast foods, bagel, with egg, sausage patty, cheese, and condiments",Snack,295,13,17,22.6
"Fast foods, bagel, with breakfast steak, egg, cheese, and condiments",Snack,1180,16,14.1,23
"Light Ice Cream, soft serve, blended with milk chocolate candies",Snack,760,4.02,6.46,26.8
"Macaroni and Cheese, canned entree",Snack,82,3.38,2.46,11.5
"HOT POCKETS, CROISSANT POCKETS Chicken, Broccoli, and Cheddar Stuffed Sandwich, frozen",Lunch,235,8.9,8.6,30.4
"HOT POCKETS Ham 'N Cheese Stuffed Sandwich, frozen",Snack,270,9.16,15,24.7
"Ravioli, cheese-filled, canned",Snack,77,2.48,1.45,13.6
"Ravioli, meat-filled, with tomato sauce or meat sauce, canned",Snack,97,3.24,3.41,13.3
"Beef stew, canned entree",Lunch,99,4.41,5.53,7.85
"Chicken pot pie, frozen entree, prepared",Lunch,853,5.11,11.8,19.2
"Beef, corned beef hash, with potato, canned",Lunch,164,8.73,10.2,9.27
"Lasagna, cheese, frozen, prepared",Snack,130,6.54,5.33,13.8
"Lasagna with meat & sauce, frozen entree",Snack,518,6.63,4.42,14.4
"Burrito, beef and bean, frozen",Lunch,239,7.26,9.61,30.8
"Burrito, bean and cheese, frozen",Snack,925,7.07,6.3,34
"Macaroni and Cheese, canned, microwavable",Snack,134,5.98,5.99,14
"Turkey, stuffing, mashed potatoes w/gravy, assorted vegetables, frozen, microwaved",Snack,128,6.97,3.89,16.3
"Rice bowl with chicken, frozen entree, prepared (includes fried, teriyaki, and sweet and sour varieties)",Lunch,126,5.65,1.56,22.5
"Macaroni and cheese dinner with dry sauce mix, boxed, uncooked",Snack,379,13.9,4.82,70.1
"Macaroni and cheese, dry mix, prepared with 2% milk and 80% stick margarine from dry mix",Snack,794,4.89,8.28,23.9
"Macaroni and cheese, frozen entree",Snack,149,5.6,6.41,17.3
Potato salad with egg,Snack,658,1.96,9.4,16.2
Pulled pork in barbecue sauce,Snack,168,13.2,4.42,18.7
"Corn dogs, frozen, prepared",Snack,1050,8.57,12,27
"Chicken tenders, breaded, frozen, prepared",Lunch,240,14.6,13.6,14.9
"RICE-A-RONI, chicken flavor, unprepared",Lunch,356,10.6,1.04,76.1
"Rice and vermicelli mix, chicken flavor, prepared with 80% margarine",Lunch,136,2.65,3.45,23.5
"Beef, shoulder pot roast or steak, boneless, separable lean and fat, trimmed to 0"" fat, all grades, raw",Lunch,545,21.4,4.97,0
"Beef, short loin, porterhouse steak, separable lean and fat, trimmed to 1/8"" fat, all grades, raw",Lunch,897,20.5,14.1,0
"Beef, short loin, t-bone steak, separable lean and fat, trimmed to 1/8"" fat, all grades, cooked, grilled",Lunch,289,24.6,20.4,0
"Beef, short loin, t-bone steak, separable lean and fat, trimmed to 1/8"" fat, select, raw",Lunch,898,20.3,14.2,0
"Beef, short loin, t-bone steak, separable lean and fat, trimmed to 1/8"" fat, select, cooked, grilled",Lunch,281,25.2,19.2,0
"Beef, round, knuckle, tip side, steak, separable lean and fat, trimmed to 0"" fat, choice, raw",Lunch,133,21.4,4.66,0
"Beef, chuck, shoulder clod, shoulder tender, medallion, separable lean and fat, trimmed to 0"" fat, choice, cooked, grilled",Lunch,756,26.1,7.68,0
"Beef, chuck, shoulder clod, shoulder tender, medallion, separable lean and fat, trimmed to 0"" fat, select, raw",Lunch,142,20.9,5.79,0
"Beef, chuck, shoulder clod, shoulder top and center steaks, separable lean and fat, trimmed to 0"" fat, choice, raw",Lunch,597,20.4,6.12,0
"Beef, chuck, shoulder clod, shoulder top and center steaks, separable lean and fat, trimmed to 0"" fat, choice, cooked, grilled",Lunch,184,26.1,8.11,0
"Beef, chuck, shoulder clod, top blade, steak, separable lean and fat, trimmed to 0"" fat, select, raw",Lunch,694,19.4,9.22,0
"Beef, chuck, shoulder clod, top blade, steak, separable lean and fat, trimmed to 0"" fat, select, cooked, grilled",Lunch,212,25.3,11.5,0
"Beef, round, knuckle, tip center, steak, separable lean and fat, trimmed to 0"" fat, choice, raw",Lunch,629,20.7,6.85,0
"Beef, round, knuckle, tip center, steak, separable lean and fat, trimmed to 0"" fat, choice, cooked, grilled",Lunch,188,26.9,8.13,0
"Beef, round, knuckle, tip center, steak, separable lean and fat, trimmed to 0"" fat, select, raw",Lunch,574,21,5.21,0
"Beef, round, outside round, bottom round, steak, separable lean and fat, trimmed to 0"" fat, select, cooked, grilled",Lunch,166,28,5.17,0
"Beef, chuck, shoulder clod, shoulder tender, medallion, separable lean and fat, trimmed to 0"" fat, all grades, raw",Lunch,602,20.5,6.22,0
"Beef, chuck, shoulder clod, shoulder tender, medallion, separable lean and fat, trimmed to 0"" fat, all grades, cooked, grilled",Lunch,177,26.2,7.2,0
"Beef, round, knuckle, tip side, steak, separable lean and fat, trimmed to 0"" fat, all grades, raw",Lunch,539,21.7,4,0
"Beef, chuck, shoulder clod, top blade, steak, separable lean and fat, trimmed to 0"" fat, all grades, cooked, grilled",Lunch,222,24.9,12.8,0
"Beef, round, knuckle, tip center, steak, separable lean and fat, trimmed to 0"" fat, all grades, raw",Lunch,596,20.9,5.89,0
"Beef, round, knuckle, tip center, steak, separable lean and fat, trimmed to 0"" fat, all grades, cooked, grilled",Lunch,177,27.1,6.78,0
"Beef, round, outside round, bottom round, steak, separable lean and fat, trimmed to 0"" fat, all grades, raw",Lunch,594,21.6,5.53,0
"Beef, rib eye roast, boneless, lip-on, separable lean only, trimmed to 1/8"" fat, select, cooked, roasted",Lunch,202,28.7,9.68,0
"Beef, plate steak, boneless, inside skirt, separable lean only, trimmed to 0"" fat, all grades, cooked, grilled",Lunch,980,30,12.7,0
"Beef, plate steak, boneless, inside skirt, separable lean only, trimmed to 0"" fat, all grades, raw",Lunch,164,21.2,8.82,0
"Beef, plate steak, boneless, inside skirt, separable lean only, trimmed to 0"" fat, choice, cooked, grilled",Lunch,1010,29.6,13.7,0
"Beef, plate steak, boneless, outside skirt, separable lean only, trimmed to 0"" fat, all grades, raw",Lunch,206,18.7,14.5,0.19
"Beef, plate steak, boneless, outside skirt, separable lean only, trimmed to 0"" fat, choice, cooked, grilled",Lunch,1220,27,20.3,0
"Beef, plate steak, boneless, outside skirt, separable lean only, trimmed to 0"" fat, choice, raw",Lunch,212,18.5,15.3,0.17
"Beef, plate steak, boneless, outside skirt, separable lean only, trimmed to 0"" fat, select, cooked, grilled",Lunch,1120,28.6,17.1,0
"Beef, rib eye steak, boneless, lip off, separable lean only, trimmed to 0"" fat, choice, raw",Lunch,162,21.4,8.5,0
"Beef, rib eye steak, boneless, lip off, separable lean only, trimmed to 0"" fat, select, cooked, grilled",Lunch,801,29.2,8.31,0
"Beef, rib eye steak, boneless, lip off, separable lean only, trimmed to 0"" fat, select, raw",Lunch,142,22.5,5.78,0
"Beef, rib, back ribs, bone-in, separable lean only, trimmed to 0"" fat, all grades, cooked, braised",Lunch,1250,28.4,20.6,0
"Beef, rib, back ribs, bone-in, separable lean only, trimmed to 0"" fat, select, raw",Lunch,221,19.7,15.7,0.2
"Beef, rib eye steak, bone-in, lip-on, separable lean and fat, trimmed to 1/8"" fat, choice, cooked, grilled",Lunch,1310,22.7,24.7,0
"Beef, rib eye steak, bone-in, lip-on, separable lean and fat, trimmed to 1/8"" fat, select, cooked, grilled",Lunch,304,23.2,23.5,0
"Beef, rib eye steak, bone-in, lip-on, separable lean and fat, trimmed to 1/8"" fat, all grades, cooked, grilled",Lunch,1300,22.9,24.2,0
"Beef, rib eye roast, bone-in, lip-on, separable lean and fat, trimmed to 1/8"" fat, choice, cooked, roasted",Lunch,307,23.5,23.6,0
"Beef, rib eye steak/roast, bone-in, lip-on, separable lean and fat, trimmed to 1/8"" fat, select, raw",Lunch,1040,18.4,19.3,0
"Beef, rib eye steak, boneless, lip-on, separable lean and fat, trimmed to 1/8"" fat, choice, cooked, grilled",Lunch,303,22.9,23.5,0
"Beef, rib eye steak, boneless, lip-on, separable lean and fat, trimmed to 1/8"" fat, select, cooked, grilled",Lunch,1140,24.8,19.2,0
"Beef, rib eye steak, boneless, lip-on, separable lean and fat, trimmed to 1/8"" fat, all grades, cooked, grilled",Lunch,291,23.7,21.8,0
"Beef, rib eye steak/roast, boneless, lip-on, separable lean and fat, trimmed to 1/8"" fat, choice, raw",Lunch,1060,18.4,20,0
"Beef, rib eye steak/roast, boneless, lip-on, separable lean and fat, trimmed to 1/8"" fat, select, raw",Lunch,230,19.6,16.9,0
"Beef, plate steak, boneless, inside skirt, separable lean and fat, trimmed to 0"" fat, all grades, cooked, grilled",Lunch,1030,29.4,14.2,0
"Beef, plate steak, boneless, inside skirt, separable lean and fat, trimmed to 0"" fat, choice, cooked, grilled",Lunch,253,28.9,15.3,0
"Beef, plate steak, boneless, outside skirt, separable lean and fat, trimmed to 0"" fat, all grades, cooked, grilled",Lunch,1220,27.1,20.5,0
"Beef, plate steak, boneless, outside skirt, separable lean and fat, trimmed to 0"" fat, choice, cooked, grilled",Lunch,300,26.5,21.6,0
"Beef, plate steak, boneless, outside skirt, separable lean and fat, trimmed to 0"" fat, select, cooked, grilled",Lunch,1170,28,18.8,0
"Beef, plate steak, boneless, outside skirt, separable lean and fat, trimmed to 0"" fat, all grades, raw",Lunch,232,18,17.6,0.35
"Beef, rib eye steak, boneless, lip off, separable lean and fat, trimmed to 0"" fat, select, cooked, grilled",Lunch,1040,26.3,15.9,0
"Beef, rib eye steak, boneless, lip off, separable lean and fat, trimmed to 0"" fat, all grades, raw",Lunch,228,19.3,16.7,0.12
"Beef, rib eye steak, boneless, lip off, separable lean and fat, trimmed to 0"" fat, choice, raw",Lunch,1010,18.7,18.4,0.2
"Beef, rib eye steak, boneless, lip off, separable lean and fat, trimmed to 0"" fat, select, raw",Lunch,208,20.1,14.1,0
"Beef, rib, back ribs, bone-in, separable lean and fat, trimmed to 0"" fat, choice, raw",Lunch,1400,15.8,29.9,0.9
"Beef, rib, back ribs, bone-in, separable lean and fat, trimmed to 0"" fat, select, raw",Lunch,305,16.8,26.2,0.6
"Beef, loin, top sirloin petite roast, boneless, separable lean only, trimmed to 0"" fat, choice, cooked, roasted",Lunch,173,29,6.37,0
"Beef, loin, top sirloin petite roast/filet, boneless, separable lean only, trimmed to 0"" fat, choice, raw",Lunch,551,23,4.4,0
"Beef, loin, top sirloin cap steak, boneless, separable lean only, trimmed to 1/8"" fat, select, raw",Lunch,535,21.4,4.68,0
"Butter, salted",Snack,3000,0.85,81.1,0.06
"Butter, whipped, with salt",Snack,3060,0.49,78.3,0
"Butter oil, anhydrous",Snack,3660,0.28,99.5,0
"Cheese, caraway",Snack,376,25.2,29.2,3.06
"Cheese, cheddar (Includes foods for USDA's Food Distribution Program)",Snack,1680,22.9,33.3,3.37
"Cheese, cheshire",Snack,387,23.4,30.6,4.78
"Cheese, colby",Snack,1650,23.8,32.1,2.57
"Cheese, cottage, lowfat, 1% milkfat",Snack,303,12.4,1.02,2.72
"Cheese, cream",Snack,350,6.15,34.4,5.52
"Cheese, edam",Snack,357,25,28.6,1.43
"Cheese, feta",Snack,1110,14.2,21.5,3.88
"Egg, yolk, raw, frozen, pasteurized",Snack,1240,15.5,25.6,0.81
"Egg, yolk, raw, frozen, sugared, pasteurized",Snack,307,13.9,22.8,11
"Egg, whole, cooked, fried",Snack,196,13.6,14.8,0.83
"Egg, whole, cooked, hard-boiled",Snack,155,12.6,10.6,1.12
"Egg, whole, dried, stabilized, glucose reduced",Snack,615,48.2,44,2.38
"Egg, white, dried, flakes, stabilized, glucose reduced",Snack,351,76.9,0.04,4.17
"Egg, white, dried, powder, stabilized, glucose reduced",Snack,376,82.4,0.04,4.47
"Egg, yolk, dried",Snack,2800,33.6,59.1,0.66
"Egg substitute, powder",Snack,1860,55.5,13,21.8
"Butter, without salt",Snack,3000,0.85,81.1,0.06
"Cheese, parmesan, shredded",Snack,415,37.9,27.3,3.41
"Milk, nonfat, fluid, without added vitamin A and vitamin D (fat free or skim)",Snack,144,3.37,0.18,4.86
"Cheese, goat, semisoft type",Snack,1520,21.6,29.8,0.12
"Yogurt, Greek, 2% fat, key lime blend, CHOBANI",Snack,92,7.75,1.47,11.9
"Cheese, goat, soft type",Snack,1110,18.5,21.1,0
"Egg, yolk, raw, frozen, salted, pasteurized",Snack,1150,14.1,22.9,1.77
"Cheese, mexican, queso asadero",Snack,356,22.6,25,4.13
"Cheese, mexican, queso chihuahua",Snack,1570,21.6,29.7,5.56
"Cheese, low fat, cheddar or colby",Snack,173,24.4,7,1.91
"Cheese, low-sodium, cheddar or colby",Snack,1670,24.4,32.6,1.91
"Milk, fluid, 1% fat, without added vitamin A and vitamin D",Snack,177,3.37,0.97,4.99
"Sour cream, reduced fat",Snack,181,7,14.1,7
"Sour cream, light",Snack,136,3.5,10.6,7.1
"Sour cream, fat free",Snack,74,3.1,0,15.6
"Yogurt, vanilla or lemon flavor, nonfat milk, sweetened with low-calorie sweetener",Snack,180,3.86,0.18,7.5
KRAFT CHEEZ WHIZ LIGHT Pasteurized Process Cheese Product,Snack,215,16.3,9.5,16.2
KRAFT FREE Singles American Nonfat Pasteurized Process Cheese Product,Snack,148,22.7,1,11.7
KRAFT VELVEETA Pasteurized Process Cheese Spread,Snack,303,16.3,22,9.8
KRAFT VELVEETA LIGHT Reduced Fat Pasteurized Process Cheese Product,Snack,222,19.6,10.6,11.8
"Milk, chocolate, fluid, commercial, reduced fat, with added calcium",Snack,78,2.99,1.9,12.1
"Yogurt, fruit, lowfat, with low calorie sweetener",Snack,440,4.86,1.41,18.6
"Cheese, parmesan, dry grated, reduced fat",Snack,265,20,20,1.37
"Cream substitute, flavored, liquid",Snack,1050,0.69,13.5,35.1
"Milk, dry, whole, without added vitamin D",Snack,2080,26.3,26.7,38.4
"Cheese product, pasteurized process, American, reduced fat, fortified with vitamin D",Snack,1000,17.6,14.1,10.6
"Yogurt, fruit, low fat, 9 grams protein per 8 ounce, fortified with vitamin D",Snack,99,3.98,1.15,18.6
"Yogurt, fruit, low fat, 10 grams protein per 8 ounce, fortified with vitamin D",Snack,426,4.37,1.08,19
"Yogurt, fruit variety, nonfat, fortified with vitamin D",Snack,399,4.4,0.2,19
"Protein supplement, milk based, Muscle Milk, powder",Snack,1720,45.7,17.1,18.5
"Protein supplement, milk based, Muscle Milk Light, powder",Snack,396,50,12,22
Dulce de Leche,Snack,1320,6.84,7.35,55.4
"Egg substitute, liquid or frozen, fat free",Snack,48,10,0,2
"Yogurt, vanilla flavor, lowfat milk, sweetened with low calorie sweetener",Snack,361,4.93,1.25,13.8
"Yogurt, frozen, flavors not chocolate, nonfat milk, with low-calorie sweetener",Snack,104,4.4,0.8,19.7
"Ice cream, soft serve, chocolate",Snack,930,4.1,13,22.2
"Ice cream, bar or stick, chocolate covered",Snack,331,4.1,24.1,24.5
"Fat free ice cream, no sugar added, flavors other than chocolate",Snack,133,4.41,0,28.9
"Salt, table",Snack,0,0,0,0
"Vinegar, cider",Snack,90,0,0,0.93
"Thyme, fresh",Snack,101,5.56,1.68,24.4
Vanilla extract,Snack,288,0.06,0.06,12.6
"Horseradish, prepared",Snack,201,1.18,0.69,11.3
"Rosemary, fresh",Snack,131,3.31,5.86,20.7
"Peppermint, fresh",Snack,70,3.75,0.94,14.9
"Spearmint, fresh",Snack,184,3.29,0.73,8.41
"Seasoning mix, dry, chili, original",Snack,335,10.8,7.3,56.6
Clif Z bar,Snack,1740,5.55,9.72,74.7
"Babyfood, juice treats, fruit medley, toddler",Snack,1450,0,0.02,86.7
"Babyfood, meat, beef, strained",Lunch,337,12,2.52,2.43
"Babyfood, meat, ham, junior",Snack,97,11.3,3.8,3.7
"Babyfood, meat, lamb, strained",Snack,94,14.1,3.41,0.85
"Babyfood, meat, lamb, junior",Snack,112,15.2,5.2,0
"Babyfood, meat, chicken, strained",Lunch,545,13.7,7.9,0.1
"Babyfood, meat, turkey sticks, junior",Snack,188,13.7,14.2,1.4
"Babyfood, snack, GERBER GRADUATE FRUIT  STRIPS, Real Fruit Bars",Snack,330,0.82,2.24,76.6
"Babyfood, meat, meat sticks, junior",Snack,184,13.4,14.6,1.1
"Babyfood, GERBER, 2nd Foods, apple, carrot and squash, organic",Snack,266,1.1,0,14.8
"Babyfood, dinner, vegetables and dumplings and beef, junior",Lunch,48,2.1,0.8,8
"Babyfood, dinner, beef lasagna, toddler",Lunch,77,4.2,2.1,10
"Babyfood, dinner, macaroni and tomato and beef, strained",Lunch,61,2.36,1.47,9.45
"Babyfood, dinner, macaroni and tomato and beef, junior",Lunch,59,2.5,1.1,9.4
"Babyfood, dinner, spaghetti and tomato and meat, junior",Snack,285,2.57,1.37,11.4
"Babyfood, dinner, spaghetti and tomato and meat, toddler",Snack,75,5.3,1,10.8
"Babyfood, dinner, vegetables and beef, strained",Lunch,321,2.21,3.6,8.84
"Babyfood, dinner, vegetables and beef, junior",Lunch,321,2.21,3.6,8.84
"Babyfood, dinner, chicken soup, strained",Lunch,50,1.6,1.7,7.2
"Babyfood, dinner, chicken stew, toddler",Lunch,78,5.2,3.7,6.4
"Babyfood, dinner, vegetables chicken, strained",Lunch,59,2.47,1.73,8.42
"Babyfood, dinner, vegetables, noodles and chicken, strained",Lunch,63,2,2.5,7.9
"Babyfood, dinner, turkey and rice, junior",Snack,56,2.37,0.92,9.57
"Babyfood, dinner, vegetables and turkey, strained",Snack,48,2.32,0.9,7.62
"Babyfood, dinner, vegetables and turkey, junior",Snack,53,1.72,1.74,7.55
"Babyfood, dinner, macaroni and cheese, strained",Snack,67,3.14,2.11,8.95
"Babyfood, vegetable, green beans and potatoes",Snack,62,2.2,1.9,9
"Babyfood, vegetables, beets, strained",Snack,34,1.3,0.1,7.7
"Babyfood, vegetables, carrots, strained",Snack,109,0.8,0.1,6
"Babyfood, vegetables, carrots, junior",Snack,32,0.8,0.2,7.2
"Babyfood, potatoes, toddler",Snack,52,1,0.1,11.7
"Babyfood, cereal, Oatmeal, dry, GERBER, SINGLE GRAIN, fortified",Breakfast,1660,10.9,6.42,73.6
"Babyfood, vegetable, butternut squash and corn",Snack,211,2,0.6,9.26
"Babyfood, apples, dices, toddler",Snack,50,0.19,0.36,11.6
"Babyfood, fruit, applesauce, strained",Snack,41,0.2,0.2,10.8
"Babyfood, dinner, vegetables and chicken, junior",Lunch,53,2.04,1.12,8.66
"Babyfood, dinner, mixed vegetable, strained",Snack,41,1.2,0.1,9.5
"Babyfood, vegetables, mix vegetables strained",Snack,36,1,0.5,8.25
"Babyfood, dinner, beef noodle, junior",Lunch,57,2.5,1.9,7.3
"Babyfood, apples with ham, strained",Snack,62,2.6,0.9,10.9
"Babyfood, carrots and beef, strained",Lunch,59,3.4,2.5,5.7
"Babyfood, beverage, GERBER, GRADUATES, FRUIT SPLASHERS",Snack,123,0,0,7.35
"Babyfood, snack, GERBER, GRADUATES, YOGURT MELTS",Snack,380,14.3,4,71.8
"Babyfood, dinner, sweet potatoes and chicken, strained",Lunch,310,2.51,2.17,11
"Infant formula, MEAD JOHNSON, Enfamil 24, ready to feed, with ARA and DHA",Snack,71,1.64,4.1,6.93
"Infant formula, MEAD JOHNSON, Enfamil Enspire Powder, with ARA and DHA, not reconstituted",Snack,2150,10.5,27,57.2
"Infant formula, MEAD JOHNSON, Enfamil Reguline, ready to feed, with ARA and DHA",Snack,68,1.51,3.5,7.6
"Infant formula, MEAD JOHNSON, Gentlease, ready to feed, with ARA and DHA",Snack,284,1.5,3.5,7.61
"Toddler formula, MEAD JOHNSON, Nutramigen Toddler with LGG Powder, with ARA and DHA, not reconstituted",Snack,485,12,21,62
